{
  "$schema": "./tests.schema.json",
  "_comment": "CoreMark benchmark",
  "extends": "default",
  "test_list": "sim/test/coremark_test_list.flist",
  "simulation": {
    "max_cycles": 50000000,
    "build_threads": "auto",
    "sim_threads": 16
  },
  "defines": {
    "COMMIT_TRACER": true,
    "KONATA_TRACER": false,
    "LOG_COMMIT": true,
    "SIM_FAST": true,
    "LOG_UART": true,
    "LOG_BP": true,
    "SIM_UART_MONITOR": true
  }
}
