{
  "$schema": "./tests.schema.json",
  "_comment": "riscv-arch-test compliance",
  "extends": "default",
  "test_list": "sim/test/arch_test_list.flist",
  "simulation": {
    "max_cycles": 30000
  },

  "defines": {
    "COMMIT_TRACER": true,
    "KONATA_TRACER": true,
    "LOG_COMMIT": true,
    "LOG_RAM": false,
    "LOG_UART": false,
    "LOG_BP": true,
    "SIM_FAST": false,
    "SIM_UART_MONITOR": false
  }
}
