{
  "$schema": "./tests.schema.json",
  "_comment": "Benchmark tests (dhrystone, etc)",
  "extends": "default",
  "test_list": "sim/test/bench_test_list.flist",
  "simulation": { "max_cycles": 500000 },
  "defines": { "LOG_COMMIT": false, "TRACE_KONATA": false, "SIM_FAST": true, "LOG_UART": true }
}
